{
  "$schema": "https://json-schema.org/draft/2020-12/schema",
  "$id": "https://esummit.iiti.ac.in/devcraft/schema.json",
  "title": "DevCraft Order Record",
  "description": "The exact output contract for Objective 1. Field names and types are fixed and MUST NOT be modified. See DATASET_CARD.md for the scoring policy, the attribute key vocabulary, and the needs_clarification decision rule.",
  "type": "object",
  "required": ["customer", "items", "due_date", "amount", "references_prior_order", "confidence", "needs_clarification"],
  "additionalProperties": false,
  "properties": {
    "customer": {
      "type": ["string", "null"],
      "description": "Customer name if stated or clearly implied in the message, else null."
    },
    "items": {
      "type": "array",
      "description": "One entry per distinct item ordered. Empty array is valid when no item can be identified (see needs_clarification rule (a)).",
      "items": {
        "type": "object",
        "required": ["description", "quantity", "attributes"],
        "additionalProperties": false,
        "properties": {
          "description": {
            "type": "string",
            "description": "The item, normalised to lowercase singular. Scored by token-set F1 >= 0.80 against gold."
          },
          "quantity": {
            "type": "integer",
            "minimum": 1,
            "description": "Count ordered. An unmarked item means 1."
          },
          "attributes": {
            "type": "object",
            "description": "Keys MUST come from the domain vocabulary in x-devcraft-vocabulary. Unknown keys are scored as wrong.",
            "additionalProperties": {"type": ["string", "number", "boolean"]}
          }
        }
      }
    },
    "due_date": {
      "type": ["string", "null"],
      "pattern": "^[0-9]{4}-[0-9]{2}-[0-9]{2}$",
      "description": "ISO-8601 calendar date (YYYY-MM-DD), resolved against the input record's received_at in Asia/Kolkata. null when no deadline is stated, or when a stated deadline cannot be resolved."
    },
    "amount": {
      "type": ["number", "null"],
      "description": "Money stated in the message, in INR, as a number without currency symbols. null if not stated."
    },
    "references_prior_order": {
      "type": "boolean",
      "description": "true when the message refers to a previous order ('last time jaisa', 'pichli baar wala')."
    },
    "confidence": {
      "type": "number",
      "minimum": 0,
      "maximum": 1,
      "description": "Self-reported confidence. NOT SCORED in Test A; used only as a tie-break. Emit it anyway - the schema requires it."
    },
    "needs_clarification": {
      "type": "boolean",
      "description": "true iff a REFERENCED field cannot be resolved. A field that is simply absent is null, not a clarification. See DATASET_CARD.md."
    }
  },

  "x-devcraft-input-format": {
    "description": "Records you are given (train) and that judges feed you (test) have this shape. received_at is an INPUT field and is the anchor for every relative date.",
    "example": {
      "id": "train-0007",
      "domain": "tailor",
      "received_at": "2026-08-29T10:14:00+05:30",
      "message": "bhaiya 2 kurta chahiye navy blue, chest 40, parso tak ho jayega kya? last time jaisa hi"
    }
  },

  "x-devcraft-vocabulary": {
    "description": "Closed set of attribute keys per domain. Emitting a key outside this list scores as wrong.",
    "tailor": ["color", "fabric", "chest", "waist", "length", "sleeve", "size", "fit"],
    "tiffin": ["portion", "spice_level", "meal", "roti_count", "jain", "days"],
    "electrician": ["appliance", "issue", "room", "brand", "wattage"],
    "baker": ["flavour", "weight_kg", "egg_free", "tier", "message_on_cake", "shape"]
  }
}
