[
  {
    "customer": null,
    "items": [],
    "due_date": "2026-08-30",
    "amount": 150,
    "references_prior_order": false,
    "confidence": 0.1,
    "needs_clarification": true
  },
  {
    "customer": null,
    "items": [
      {
        "description": "bread loaf",
        "quantity": 2,
        "attributes": {}
      }
    ],
    "due_date": null,
    "amount": null,
    "references_prior_order": false,
    "confidence": 1,
    "needs_clarification": false
  },
  {
    "customer": null,
    "items": [],
    "due_date": null,
    "amount": null,
    "references_prior_order": false,
    "confidence": 0.1,
    "needs_clarification": true
  },
  {
    "customer": null,
    "items": [],
    "due_date": null,
    "amount": 600,
    "references_prior_order": false,
    "confidence": 0.1,
    "needs_clarification": true
  },
  {
    "customer": null,
    "items": [],
    "due_date": null,
    "amount": null,
    "references_prior_order": false,
    "confidence": 0.1,
    "needs_clarification": true
  },
  {
    "customer": null,
    "items": [],
    "due_date": "2026-08-30",
    "amount": null,
    "references_prior_order": true,
    "confidence": 0.1,
    "needs_clarification": true
  },
  {
    "customer": null,
    "items": [
      {
        "description": "cookies",
        "quantity": 5,
        "attributes": {}
      }
    ],
    "due_date": null,
    "amount": null,
    "references_prior_order": false,
    "confidence": 1,
    "needs_clarification": true
  },
  {
    "customer": null,
    "items": [
      {
        "description": "rice",
        "quantity": 1,
        "attributes": {}
      }
    ],
    "due_date": null,
    "amount": 1200,
    "references_prior_order": false,
    "confidence": 1,
    "needs_clarification": false
  },
  {
    "customer": null,
    "items": [
      {
        "description": "paneer sabzi",
        "quantity": 3,
        "attributes": {}
      }
    ],
    "due_date": null,
    "amount": null,
    "references_prior_order": false,
    "confidence": 1,
    "needs_clarification": false
  },
  {
    "customer": null,
    "items": [],
    "due_date": "2026-09-01",
    "amount": null,
    "references_prior_order": false,
    "confidence": 0.1,
    "needs_clarification": true
  }
]